{"agency_acceptance":false,"alignment":{"geometry_ref":"data/designs/road/geometry/bonebank-road-elevation.geojson","length_ft":1800},"constraints":{"floodway_check_required":true,"no_rise_required":true,"property_rights_verified":false,"utility_conflicts_checked":false,"wetland_check_required":true},"design":{"crest_elevation_ft":378.5,"design_freeboard_ft":3.5,"feature_type":"road","side_slope_hv":4,"top_width_ft":20},"human_review_required":true,"scenario_id":"bonebank-road-elevation","simulation":{"alternative_model_ref":"data/scenarios/q100-design-event.json#with-road-bonebank-road-elevation","baseline_model_ref":"data/scenarios/q100-design-event.json","comparison_metric":"WSE_difference_ft"}}