{
  "agency_acceptance": false,
  "alignment": {
    "geometry_ref": "data/designs/berm/geometry/point-township-agricultural-berm.geojson",
    "length_ft": 5280
  },
  "constraints": {
    "floodway_check_required": true,
    "no_rise_required": true,
    "property_rights_verified": false,
    "utility_conflicts_checked": false,
    "wetland_check_required": true
  },
  "design": {
    "crest_elevation_ft": 377.0,
    "design_freeboard_ft": 7.9,
    "feature_type": "berm",
    "side_slope_hv": 3,
    "top_width_ft": 10,
    "bfe_ft_navd88": 369.1,
    "bfe_source": "FEMA FIS 18129CV000A Table 9 Section A (RM 844.75), effective 2014-11-05; verified against Indiana DNR FLOOD_XS_EFFECTIVE_DNR.csv",
    "freeboard_note": "Crest elevation unchanged from conceptual design. Freeboard recalculated against regulatory BFE 369.1 ft NAVD88 (was 2.0 ft against superseded 375.0 ft working target)."
  },
  "human_review_required": true,
  "scenario_id": "point-township-agricultural-berm",
  "simulation": {
    "alternative_model_ref": "data/scenarios/q100-design-event.json#with-berm-point-township-agricultural",
    "baseline_model_ref": "data/scenarios/q100-design-event.json",
    "comparison_metric": "inundation_area_difference_ac"
  }
}