{"agency_acceptance":false,"alignment":{"geometry_ref":"data/designs/berm/geometry/bonebank-road-residential-berm.geojson","length_ft":2400},"constraints":{"floodway_check_required":true,"no_rise_required":true,"property_rights_verified":false,"utility_conflicts_checked":false,"wetland_check_required":true},"design":{"crest_elevation_ft":378.0,"design_freeboard_ft":3.0,"feature_type":"berm","side_slope_hv":3,"top_width_ft":12},"human_review_required":true,"scenario_id":"bonebank-road-residential-berm","simulation":{"alternative_model_ref":"data/scenarios/q100-design-event.json#with-berm-bonebank-road-residential","baseline_model_ref":"data/scenarios/q100-design-event.json","comparison_metric":"WSE_difference_ft"}}